lugar de interes,distancia min,estacion bici max,direccion de lugar de interes,bicis disponibles
Agencia de Proximidad de Arganzuela,348.4467185879877,Paseo Imperial nº 20,PASEO PONTONES 10,13
Agencia de Proximidad de Barajas,6567.231972837848,Calle Gutierre de Cetina nº 77,AVENIDA CANTABRIA 6,6
Agencia de Proximidad de Carabanchel,4982.433765786693,Calle Caramuel nº 51,AVENIDA CARABANCHEL ALTO 52,7
Agencia de Proximidad de Latina,2204.856169107773,Calle Caramuel nº 51,CALLE ALHAMBRA 89,7
Agencia de Proximidad de Puente de Vallecas,359.9291383691322,Calle Arroyo del Olivar nº 6,PLAZA SIERRA MINISTRA 3,24
Agencia de Proximidad de Tetuán,267.50297792237984,Calle Doctor Santero nº 1,CALLE JUAN PANTOJA 2,2
Agencia de Proximidad de Vicálvaro,2834.3174680507786,Calle Hacienda de Pavones nº 342,AVENIDA DAROCA 327,18
Agencia de Proximidad de Villaverde,3417.1847339083556,Calle Sodio nº 1B,AVENIDA OROVILLA 54,11
Agente Tutor. Policía Municipal. Comisaría Integral de Distrito Arganzuela,239.74670114975436,Paseo de la Esperanza nº 59,PASEO CHOPERA 2,13
Agente Tutor. Policía Municipal. Comisaría Integral de Distrito Barajas,7149.644730315675,Calle Gutierre de Cetina nº 77,CALLE TRESPADERNE 16,6
Agente Tutor. Policía Municipal. Comisaría Integral de Distrito Carabanchel,5887.456617871102,Glorieta Marqués de Vadillo nº 9,AVENIDA CARABANCHEL ALTO 61,5
Agente Tutor. Policía Municipal. Comisaría Integral de Distrito Centro- Sur,94.60310975715873,Plaza del Carmen nº 1,CALLE MONTERA 16,24
Agente Tutor. Policía Municipal. Comisaría Integral de Distrito Chamartín,937.725502230006,Avenida Pío XII nº 3,CALLE COMANDANTE AZCARRAGA 4,18
Agente Tutor. Policía Municipal. Comisaría Integral de Distrito Chamberí,105.47066125255193,Calle Santa Engracia nº 168,CALLE RAIMUNDO FERNANDEZ VILLAVERDE 8,6
Agente Tutor. Policía Municipal. Comisaría Integral de Distrito Ciudad Lineal,2043.8912595524978,Calle Hacienda de Pavones nº 342,CALLE PELOPONESO 9,18
Agente Tutor. Policía Municipal. Comisaría Integral de Distrito Fuencarral - El Pardo,920.3938491130865,Calle Pedro Rico nº 4,AVENIDA SOTO PALACIOS 7,3
Agente Tutor. Policía Municipal. Comisaría Integral de Distrito Hortaleza,2500.2591460403855,Calle Carlota O'Neill nº 32,CALLE JAVIER DEL QUINTO 2,14
Agente Tutor. Policía Municipal. Comisaría Integral de Distrito Latina,5310.951032938249,Calle Caramuel nº 51,CALLE RODRIGO DE ARANA 50,7
Agente Tutor. Policía Municipal. Comisaría Integral de Distrito Moratalaz,342.2682455606752,Calle Hacienda de Pavones nº 342,CALLE FUENTE CARRANTONA 8,18
Agente Tutor. Policía Municipal. Comisaría Integral de Distrito Puente de Vallecas,1479.6050108894594,Camino de Valderribas nº 94,CALLE PUERTO DE CARDOSO 7,21
Agente Tutor. Policía Municipal. Comisaría Integral de Distrito Retiro,194.31327506898614,Calle Cerro de la Plata nº 2,CALLE HOYUELO 7,10
Agente Tutor. Policía Municipal. Comisaría Integral de Distrito Salamanca,170.21994226011935,Calle Alejandro González nº 1,CALLE PEDRO HEREDIA 34,6
Agente Tutor. Policía Municipal. Comisaría Integral de Distrito San Blas-Canillejas,4065.532746363832,Calle Gutierre de Cetina nº 77,CALLE ESTOCOLMO 91,6
Agente Tutor. Policía Municipal. Comisaría Integral de Distrito Tetuán,1069.4444538310768,Calle Azucenas nº 1,AVENIDA ASTURIAS 68,12
Agente Tutor. Policía Municipal. Comisaría Integral de Distrito Usera,1652.1766070813396,Calle Antonio López nº 129,CALLE DOCTOR TOLOSA LATOUR 16,19
Agente Tutor. Policía Municipal. Comisaría Integral de Distrito Vicálvaro,4143.0193899312935,Calle Hacienda de Pavones nº 342,PASEO POLIDEPORTIVO 138,18
Agente Tutor. Policía Municipal. Comisaría Integral de Distrito Villa de Vallecas,3275.4256693794805,Calle Hacienda de Pavones nº 342,CALLE REAL DE ARGANDA 64,18
Agente Tutor. Policía Municipal. Comisaría Integral de Distrito Villaverde,4270.230714241209,Calle Antonio López nº 129,CARRETERA CARABANCHEL A VILLAVERDE 105 C/V a la calle de la Laguna Rodrigo,19
Agente de Igualdad. Hortaleza,3770.1063047774346,Calle Carlota O'Neill nº 32,CALLE SANTA VIRGILIA 15 PLANTA 1º Radicada en el Centro Cultural Hortaleza,14
Alcaldía,140.80620275519507,Plaza Cibeles,CALLE MONTALBAN 1 PLANTA 4,21
Almacén de Villa,4151.012505372867,Calle Hacienda de Pavones nº 342,CALLE AHUMAOS 27,18
Aparcamiento disuasorio Aviación Española,6788.1296555298695,Calle Caramuel nº 51,CALLE FUENTE DE LIMA 5,7
Aparcamiento disuasorio Fuente de la Mora,2389.5815353083617,Paseo de la Castellana nº 298,AVENIDA MANOTERAS 1,13
Aparcamiento disuasorio Islazul,4379.834910372644,Glorieta Marqués de Vadillo nº 9,CALLE CALDERILLA 1,5
Aparcamiento disuasorio Pitis,4564.71179911542,Calle Pedro Rico nº 4,CALLE GLORIA FUERTES ,3
Aparcamiento mixto. Corona Boreal,6170.837929979055,Avenida Complutense nº 23,CALLE PEREZ DE VICTORIA 2,8
Aparcamiento mixto. Montalbán,239.67120290310015,Calle Antonio Maura nº 15,CALLE MONTALBAN 4 S PLANTA OT AN,6
Aparcamiento mixto. Plaza de Santo Domingo,22.520343097197852,Plaza de Santo Domingo nº 1,PLAZA SANTO DOMINGO ,24
Aparcamiento mixto. Velázquez - Jorge Juan,103.7925744834905,Calle Goya nº 18,CALLE VELAZQUEZ 1,5
Aparcamiento para residentes. Antonio Mena,596.0136765820891,Calle Camino de los Vinateros nº 108,AVENIDA DOCTOR GARCIA TAPIA 119,18
Aparcamiento para residentes. Azuaga,990.587762573015,Calle Francos Rodríguez nº 62,CALLE SAN RESTITUTO 33,3
Aparcamiento para residentes. Baviera,428.604255836724,Calle Santa Hortensia nº 31,AVENIDA AMERICA 58,8
Aparcamiento para residentes. Doce de Octubre,64.76047723907126,Calle Ibiza nº 18,CALLE ALCALDE SAINZ DE BARANDA ,13
Aparcamiento para residentes. Francisco Rioja,341.6498210454268,Calle Gutierre de Cetina nº 77,CALLE LUIS RUIZ 27,6
Aparcamiento para residentes. Francos Rodríguez,228.69165908906857,Calle Francos Rodríguez nº 62,CALLE NUMANCIA 63,3
Aparcamiento para residentes. Menorca,189.91316232641626,Calle O'Donnell nº 28,CALLE NARVAEZ ,4
Aparcamiento público. Auditorio Nacional de Música (Príncipe de Vergara),113.97648692241079,Calle María Francisca nº 1,CALLE CARTAGENA 178 PLANTA 0 01,4
Aparcamiento público. Descalzas,150.6593352597123,Plaza de Celenque nº 1,PLAZA DESCALZAS 3,24
Aparcamiento público. Glorieta Puerta de Toledo,122.0033880695186,Glorieta de la Puerta de Toledo nº 1,GLORIETA PUERTA DE TOLEDO ,13
Aparcamiento público. Las Cortes,80.88043595336919,Calle del Marqués de Cubas nº 25,PLAZA CORTES 13,10
Aparcamiento público. Luna - Tudescos (cerrado),123.21467089454957,Calle Miguel Moya nº 1,PLAZA SANTA MARIA SOLEDAD TORRES ACOSTA 2 PLANTA 0 02,24
Aparcamiento público. Mostenses,153.03942766364088,Calle San Bernardo nº 22,CALLE GARCIA MOLINAS 4,20
Aparcamiento público. Plaza de Colón,91.09571351636971,Calle Serrano nº 34,CALLE GOYA 2,5
Aparcamiento público. San Epifanio,401.5591457438962,Glorieta Marqués de Vadillo nº 9,CALLE SAN EPIFANIO 9,5
Aparcamiento público. Santa Ana (cerrado),21.21742358564202,Plaza de Santa Ana nº 10,PLAZA SANTA ANA ,23
Aparcamiento público. Velázquez - Juan Bravo,60.816607799617785,Calle Velázquez nº 75,CALLE VELAZQUEZ 88 T PLANTA OD 01,1
Aparcamiento público. Villa de París,34.94870985699003,Calle Marqués de la Ensenada nº 16,PLAZA VILLA DE PARIS 1,12
Apartamentos Municipales para Mayores 'Retiro',201.07927430764718,Calle Doctor Esquerdo nº 99,CALLE JOSE MARTINEZ DE VELASCO 22,20
Apartamentos Municipales para Mayores 'San Francisco',160.5658541408244,Plaza de San Francisco nº 5,CALLE JERTE 3,16
Aravaca Innovation Lab,6232.655732871269,Avenida Complutense nº 23,CALLE CAROLI 1,8
Archivo de Villa,71.7394231250497,Calle Conde Duque nº 22,CALLE CONDE DUQUE 11,23
Arganzuela. Unidad de Participación Ciudadana y Cooperación Público Social,127.97722295511193,Paseo de la Chopera nº 14,PASEO CHOPERA 10,4
Asesoría Jurídica. Servicio de Bastanteo de Poderes,141.3313636532696,Plaza Cibeles,CALLE MONTALBAN 1 PLANTA BAJA,21
Auditorio Carmen Laforet (Ciudad Lineal),2186.112010323209,Paseo de la Castellana nº 298,CALLE JAZMIN 46,13
Auditorio Joaquín Rosado (Moncloa-Aravaca),1056.5301896546084,Avenida Juan de Herrera frente a la calle Paul Guinard,CALLE SANTA POLA 22,5
Auditorio Municipal Las Trece Rosas,2938.6969355749793,Calle Hacienda de Pavones nº 342,CALLE MONTE DE MONTJUICH 7 acceso por calle Sierra Gorda con vuelta a Sierra del Torcal,18
Auditorio Municipal al aire libre Lola Camarena,3968.6108521269102,Calle Hacienda de Pavones nº 342,AVENIDA LA GAVIA 13,18
Auditorio Municipal el Espinillo,3067.467053983168,Calle Sodio nº 1B,CALLE TERTULIA 5,11
Auditorio Parque de la Cuña Verde de Vicálvaro,2543.964911561434,Calle Hacienda de Pavones nº 342,CALLE CASALARREINA 26,18
Auditorio al Aire Libre Recinto Ferial Vicálvaro,4271.955839514475,Calle Hacienda de Pavones nº 342,PASEO POLIDEPORTIVO 142,18
Auditorio al aire libre Berlín,384.3941326191798,Avenida de Concha Espina nº 34,CALLE SAN ERNESTO 10,6
Auditorio al aire libre. Carlos Jiménez de Parga,1231.6239115003427,Calle Hacienda de Pavones nº 342,AVENIDA RAFAEL ALBERTI 13,18
Auditorio al aire libre. Parque Aluche,3896.1256413856468,Calle Caramuel nº 51,CALLE ILLESCAS 149,7
Auditorio al aire libre. Parque Amós Acero,603.7967770328,Calle Arroyo del Olivar nº 6,CALLE SIERRA DE ALQUIFE 20,24
Auditorio al aire libre. Parque Cerro Almodóvar,2451.7706813068494,Calle Caramuel nº 51,CALLE MARCELINO CASTILLO 29,7
Auditorio al aire libre. Parque Enrique Tierno Galván,585.414094572679,Calle Sodio nº 1B,AVENIDA PLANETARIO 18,11
Auditorio al aire libre. Parque Lineal del Manzanares,799.5242595658923,Calle Antonio López nº 129,CAMINO PERALES 1,19
Auditorio al aire libre. Parque de Olof Palme,1185.9537404755147,Calle San Delfín nº 9,CALLE CERECINOS 1,17
Auditorio al aire libre. Parque de Pradolongo,2027.1000019366895,Calle Antonio López nº 129,AVENIDA POBLADOS 169,19
Auditorio al aire libre. Parque de la Cuña Verde de O´Donnell,1459.1124604506172,Calle Hacienda de Pavones nº 342,CALLE FUENTE CARRANTONA 61,18
Auditorio al aire libre. Parque del Calero,247.4793406091464,Calle Jose del Hierro nº 5,CALLE JOSE DEL HIERRO 3,20
Auditorio al aire libre. Pavones,302.61829533956785,Calle Hacienda de Pavones nº 342,CALLE HACIENDA DE PAVONES 209,18
Auditorio al aire libre. Pilar García Peña (Parque Pinar del Rey),2230.665499244678,Calle Colombia nº 7,CARRETERA CANILLAS 1,6
Auditorio al aire libre. Plaza de Ermua,2588.2972561476,Calle Antonio López nº 129,CALLE GUETARIA 56,19
Auditorio de la Plaza de Chamberí - Templete,326.6431640608124,Calle Manuel Silvela nº 20,TEMPLETE PLAZA DE CHAMBERI ,19
Auditorio y sala de exposiciones Paco de Lucía (Latina),4804.53544304538,Calle Caramuel nº 51,AVENIDA LAS AGUILAS 2,7
Aula Municipal de Formación de Personas Adultas. Distrito Centro.,247.64845116154223,Calle Ribera de Curtidores nº 28,CALLE CASINO 5,12
Aula Municipal de Formación de Personas Adultas. Distrito Ciudad Lineal.,214.30536298551843,Avenida Marqués de Corbera nº 52,CALLE SANTA FELICIDAD 39 EN CENTRO CULTURAL ELIPA,18
Aula Municipal de Formación de Personas Adultas. Distrito San Blas - Canillejas.,2385.508204510001,Calle Gutierre de Cetina nº 77,CALLE SAN ROMAN DEL VALLE 8 EN CENTRO CULTURAL ANTONIO MACHADO,6
Aula Municipal de Formación de Personas Adultas. Distrito Villaverde. Calle Doctor Martín Arévalo.,4831.532693348284,Calle Antonio López nº 129,CALLE DOCTOR MARTIN AREVALO 2 CENTRO CULTURAL ÁGATA,19
Aula Municipal de Formación de Personas Adultas. Distrito Villaverde. Plaza Los Pinazo.,5186.293415153825,Calle Sodio nº 1B,PLAZA PINAZO 9,11
Aula ambiental La Cabaña del Retiro,132.09731661934126,Avenida de Menéndez Pelayo con calle Poeta Esteban Villegas,PASEO FERNAN NUÑEZ 10,10
Aula de estudio de Manoteras. Sala de estudio (Hortaleza),2850.5059915890865,Avenida Pío XII nº 3,CALLE CUEVAS DEL ALMANZORA 187,18
Banda Sinfónica Municipal de Madrid,1427.839483638126,Plaza Puerta del Ángel nº 4,AVENIDA PRINCIPAL 9 Teatro Auditorio Casa de Campo,17
Barajas. Unidad de Participación Ciudadana y Cooperación Público Social,8655.952536735082,Calle Gutierre de Cetina nº 77,PLAZA MERCURIO 1,6
Bibliometro,84.25403826053233,Calle Conde Duque nº 22,CALLE CONDE DUQUE 11,23
Bibliored Dolores Catarineu de Aravaca,6232.655732871269,Avenida Complutense nº 23,CALLE CAROLI 1,8
Bibliored Galileo,224.47011990353843,Calle Fernando el Católico nº 19,CALLE GALILEO 39,12
Bibliored Sala Corín Tellado,1056.5301896546084,Avenida Juan de Herrera frente a la calle Paul Guinard,CALLE SANTA POLA 22,5
Bibliored Sala León Felipe,4300.972196790217,Calle Sodio nº 1B,CALLE LEONOR GONGORA 19,11
Bibliored Salamanca,129.3774221744736,Calle Ayala nº 44,CALLE NUÑEZ DE BALBOA 40,1
Biblioteca Digital memoriademadrid,71.7394231250497,Calle Conde Duque nº 22,CALLE CONDE DUQUE 11,23
Biblioteca Histórica Municipal,19.800909134641103,Calle Conde Duque nº 22,CALLE CONDE DUQUE 9,23
Biblioteca Musical Víctor Espinós,19.800909134641103,Calle Conde Duque nº 22,CALLE CONDE DUQUE 9,23
Biblioteca Pública Municipal Aluche (Latina),3423.901233993844,Calle Caramuel nº 51,CALLE CAMARENA 10,7
Biblioteca Pública Municipal Ana María Matute (Carabanchel),392.4153411580137,Glorieta Marqués de Vadillo nº 9,CALLE ISAAC ALBENIZ 1,5
Biblioteca Pública Municipal Benito Pérez Galdós (Centro),18.890529121537565,Calle Conde Duque nº 22,CALLE CONDE DUQUE 9,23
Biblioteca Pública Municipal Ciudad Lineal (Ciudad Lineal),856.4481744952232,Calle Gutierre de Cetina nº 77,CALLE HERMANOS GARCIA NOBLEJAS 14,6
Biblioteca Pública Municipal David Gistau (Salamanca),56.314611844108526,Avenida de los Toreros nº 3,AVENIDA TOREROS 5,5
Biblioteca Pública Municipal Dámaso Alonso (Chamartín),431.8890788310135,Calle General López Pozas nº 2,CALLE MANUEL FERRERO 1,5
Biblioteca Pública Municipal Eugenio Trías. Casa de Fieras de El Retiro (Retiro),236.13897678530765,Avenida de Menéndez Pelayo nº 63,PASEO FERNÁN NÚÑEZ 24,18
Biblioteca Pública Municipal Francisco Ayala (Vicálvaro),1485.3049384705478,Calle Hacienda de Pavones nº 342,BULEVAR INDALECIO PRIETO 21,18
Biblioteca Pública Municipal Francisco Ibáñez (Chamartín),391.04183108052484,Avenida del Doctor Arce nº 45,CALLE MANTUANO 51,3
Biblioteca Pública Municipal Gabriel García Márquez (Usera),2471.6276968738543,Calle Antonio López nº 129,PLAZA PUEBLO 2 CENTRO CULTURAL ORCASUR,19
Biblioteca Pública Municipal Gerardo Diego (Villa de Vallecas),2829.1028560496675,Calle Hacienda de Pavones nº 342,CALLE MONTE AYA 12,18
Biblioteca Pública Municipal Gloria Fuertes (Barajas),6290.502007265249,Calle Gutierre de Cetina nº 77,AVENIDA LOGROÑO 179,6
Biblioteca Pública Municipal Huerta de la Salud (Hortaleza),3572.6096636979214,Calle Carlota O'Neill nº 32,CALLE MAR DE LAS ANTILLAS 10,14
Biblioteca Pública Municipal Iván de Vargas (Centro),53.314631252345585,Plaza del Cordón,CALLE SAN JUSTO 5,12
Biblioteca Pública Municipal José Hierro (San Blas-Canillejas),3417.3876431083713,Calle Gutierre de Cetina nº 77,CALLE MARIA SEVILLA DIAGO 15,6
Biblioteca Pública Municipal José Saramago (Fuencarral-El Pardo),2197.623437917444,Calle Azucenas nº 1,AVENIDA MONFORTE DE LEMOS 38,12
Biblioteca Pública Municipal La Chata (Carabanchel),3247.4780887957795,Calle Caramuel nº 51,CALLE GENERAL RICARDOS 252 Antiguo Mercado de Carabanchel,7
Biblioteca Pública Municipal La Elipa (Ciudad Lineal),322.342901509374,Avenida Marqués de Corbera nº 52,CALLE NUESTRA SEÑORA DEL VILLAR 6,18
Biblioteca Pública Municipal Manuel Vázquez Montalbán (Tetuán),295.41682763710116,Calle Francos Rodríguez nº 62,CALLE FRANCOS RODRIGUEZ 67,3
Biblioteca Pública Municipal Mario Vargas Llosa (Centro),78.21756507423994,Calle Barceló nº 7,CALLE BARCELO 4,21
Biblioteca Pública Municipal María Lejárraga (Hortaleza),3560.963507058209,Paseo de la Castellana nº 298,CALLE PRINCESA DE EBOLI 29,13
Biblioteca Pública Municipal María Zambrano (Tetuán),669.5108511966629,Calle Azucenas nº 1,PLAZA DONOSO 5 En el Centro Cultural Eduardo Úrculo,12
Biblioteca Pública Municipal Miguel Delibes (Moratalaz),441.11072153361897,Calle Arroyo de las Pilillas nº 6,CALLE ARROYO BELINCOSO 11 JUNTO A CENTRO CULTURAL EDUARDO CHILLIDA,18
Biblioteca Pública Municipal Pablo Neruda (Ciudad Lineal),84.27872649527725,Calle Gutierre de Cetina nº 77,CALLE ASCAO 4,6
Biblioteca Pública Municipal Portazgo (Puente de Vallecas),882.1979182905268,Camino de Valderribas nº 94,CALLE CANTALAPIEDRA 11,21
Biblioteca Pública Municipal Pozo del Tío Raimundo (Puente de Vallecas),2340.989139312286,Calle Arroyo del Olivar nº 6,AVENIDA GLORIETAS 19 EN C. CULTURAL POZO TIO RAIMUNDO,24
Biblioteca Pública Municipal Pío Baroja (Arganzuela),306.30335686103496,Paseo de Yeserías nº 45,CALLE ARGANDA 12,23
Biblioteca Pública Municipal San Blas (San Blas-Canillejas),2385.508204510001,Calle Gutierre de Cetina nº 77,CALLE SAN ROMAN DEL VALLE 8 CENTRO CULTURAL ANTONIO MACHADO,6
Biblioteca Pública Municipal San Fermín (Usera),2031.9465770390466,Calle Sodio nº 1B,AVENIDA SAN FERMIN 10,11
Biblioteca Pública Municipal Vallecas (Puente de Vallecas),139.59592288932677,Calle Arroyo del Olivar nº 6,CALLE PUERTO DEL MONASTERIO 1,24
Biblioteca Pública Municipal Vicálvaro,2946.7976074255866,Calle Hacienda de Pavones nº 342,CALLE VILLARDONDIEGO 36 CENTRO CULTURAL EL MADROÑO,18
Biblioteca Pública Municipal Ángel González (Latina),4441.959942524451,Calle Caramuel nº 51,CALLE GRANJA DE TORREHERMOSA 1,7
Biblioteca Técnica,207.35684469400482,Calle Conde Duque nº 22,CALLE CONDE DUQUE 9,23
"Bolsa de Empleo del Sector Alimentario, Mercamadrid (Agencia de Proximidad)",3864.00479196901,Calle Arroyo del Olivar nº 6, Zona Comercial Local 1E/1F Mercamadrid. Salida 20 de la M-40 ,24
CMSc Centro Municipal de Salud Comunitaria  Chamberí,315.299557064417,Calle Fernández de la Hoz nº 29,CALLE RAFAEL CALVO 6,9
CMSc Centro Municipal de Salud Comunitaria Arganzuela,151.85540100368152,Glorieta de la Puerta de Toledo nº 1,CALLE CONCEJAL BENITO MARTIN LOZANO 1,13
CMSc Centro Municipal de Salud Comunitaria Carabanchel,4076.8202214170137,Calle Caramuel nº 51,CALLE EUGENIA DE MONTIJO 90,7
CMSc Centro Municipal de Salud Comunitaria Centro,107.5011924675112,Calle Jacometrezo nº 3,CALLE NAVAS DE TOLOSA 10,24
CMSc Centro Municipal de Salud Comunitaria Ciudad Lineal,462.57039025803226,Avenida Marqués de Corbera nº 52,PLAZA DE AGUSTÍN GONZALEZ 1,18
CMSc Centro Municipal de Salud Comunitaria Fuencarral,2197.623437917444,Calle Azucenas nº 1,AVENIDA MONFORTE DE LEMOS 38,12
CMSc Centro Municipal de Salud Comunitaria Hortaleza,3196.7482885467734,Calle Carlota O'Neill nº 32,CALLE JUAN CLEMENTE NUÑEZ 3 frente a Silvano 157,14
CMSc Centro Municipal de Salud Comunitaria Latina,1187.4246667474133,Calle Caramuel nº 51,PASEO EXTREMADURA 147,7
CMSc Centro Municipal de Salud Comunitaria Puente de Vallecas,162.94728220449122,Calle Arroyo del Olivar nº 6,CALLE CONCORDIA 15,24
CMSc Centro Municipal de Salud Comunitaria Salamanca Retiro,129.3774221744736,Calle Ayala nº 44,CALLE NUÑEZ DE BALBOA 40,1
CMSc Centro Municipal de Salud Comunitaria Salud Tetuán,494.4183998359947,Calle Azucenas nº 1,CALLE AGUILEÑAS 1,12
CMSc Centro Municipal de Salud Comunitaria San Blas,2374.689569268309,Calle Gutierre de Cetina nº 77,CALLE POBLADURA DEL VALLE 13,6
CMSc Centro Municipal de Salud Comunitaria Usera,2041.8784050454933,Calle San Delfín nº 9,CALLE AVENA 3 (Esquina a calle Heno),17
CMSc Centro Municipal de Salud Comunitaria Vicálvaro,2779.862122497255,Calle Hacienda de Pavones nº 342,CALLE CALAHORRA 11,18
CMSc Centro Municipal de Salud Comunitaria Villa de Vallecas,2684.5491248852827,Calle Hacienda de Pavones nº 342,CALLE SIERRA GADOR 68,18
CMSc Centro Municipal de Salud Comunitaria Villaverde,3323.3660490716384,Calle Sodio nº 1B,AVENIDA FELICIDAD 17,11
Caja Municipal,33.94713656987756,Calle Prim nº 2,CALLE BARQUILLO 17 PLANTA 3ª,24
Canal de Isabel II,281.9906964666282,Calle Santa Engracia nº 127,CALLE SANTA ENGRACIA 125,13
Carabanchel. Unidad de Participación Ciudadana y Cooperación Público Social,3394.864739510003,Glorieta Marqués de Vadillo nº 9,PLAZA CARABANCHEL 1 Junta Municipal del Distrito de Carabanchel,5
Casa Grande en Carabanchel,3400.4352561468413,Glorieta Marqués de Vadillo nº 9,CALLE MONSEÑOR OSCAR ROMERO 4,5
Casa Grande en Villa de Vallecas,3820.167579533221,Calle Hacienda de Pavones nº 342,CALLE VIRGEN DE LAS VI&amp;Ntilde;AS 11,18
"Casa de Baños. Calle Bravo Murillo, 133 (baños públicos)",279.51523249364305,Calle Doctor Santero nº 1,CALLE BRAVO MURILLO 133,2
Casa de Baños. Glorieta de Embajadores (baños públicos),24.75146821549206,Glorieta de Embajadores nº 2,GLORIETA EMBAJADORES 2,23
Casa de La Panadería,83.05799297154509,Calle Mayor nº 20,PLAZA MAYOR 27,27
Castillo de la Alameda,6205.396855529535,Calle Gutierre de Cetina nº 77,CALLE ANTONIO SANCHA 1,6
Cementerio Civil,1087.08844282158,Calle Gutierre de Cetina nº 77,AVENIDA DAROCA 103,6
Cementerio Cristo de El Pardo,10066.309985684871,Avenida Complutense nº 23,CEMENTERIO CRISTO DE EL PARDO ,8
Cementerio Sur,3327.492095354971,Calle San Delfín nº 9,CALLE ILDEFONSO GONZALEZ VALENCIA 2 PUERTA PRINCIPAL,17
Cementerio de Aravaca,6640.1731977787895,Avenida Complutense nº 23,CAMINO ZARZUELA 26,8
Cementerio de Barajas,8127.866397444206,Calle Carlota O'Neill nº 32,CARRETERA CEMENTERIO NUEVO 60,14
Cementerio de Canillas,2145.48698414054,Calle Carlota O'Neill nº 32,CALLE SILVANO 69,14
Cementerio de Canillejas,3737.04228016569,Calle Gutierre de Cetina nº 77,CALLE NECTAR 34,6
Cementerio de Carabanchel Alto,4335.524316620383,Glorieta Marqués de Vadillo nº 9,CALLE VIA LUSITANA 55,5
Cementerio de El Pardo,11414.392300965917,Avenida Complutense nº 23,CARRETERA MINGORRUBIO  sin número,8
Cementerio de Fuencarral,3120.477224678825,Calle Pedro Rico nº 4,AVENIDA MONTECARMELO 10,3
Cementerio de La Almudena,21.37236187930536,Avenida de Daroca nº 2,AVENIDA DAROCA 1,20
Cementerio de Vallecas,3134.819033502077,Calle Hacienda de Pavones nº 342,CALLE PICO DE LA CIERVA 6,18
Cementerio de Villaverde,3935.654217659062,Calle Antonio López nº 129,AVENIDA RAFAELA YBARRA 137,19
Central del SAMUR Social Darío Pérez Madera,128.95258952334686,Plaza de San Francisco nº 5,CARRERA SAN FRANCISCO 10,16
Centro ASPA 4. Ámbito de actuación: Latina y Carabanchel.,6532.312586347644,Calle Caramuel nº 51,CALLE PATRIMONIO DE LA HUMANIDAD 37 C/V PALAU DE LA MÚSICA,7
Centro Comunitario Casino de la Reina,302.658662997345,Glorieta de Embajadores nº 2,CALLE CASINO 3,23
Centro Comunitario Guatemala,1819.5425895129404,Calle Francos Rodríguez nº 62,CALLE CELANOVA 2,3
Centro Concertado de Atención a las Adicciones (CCAD) Cáritas Madrid,435.7951954238147,Calle Santa Hortensia nº 31,CALLE SANTA HORTENSIA 1,8
Centro Concertado de adicciones (CCAD) Centro (Cruz Roja),210.30764059275256,Calle Santa Engracia nº 14,CALLE HERMANOS ALVAREZ QUINTERO 3,16
Centro Cultural - Centro Socio Cultural Villa de Barajas,8491.106592602362,Calle Gutierre de Cetina nº 77,CALLE BOTICA 7,6
Centro Cultural Agustín Díaz (Moncloa - Aravaca),1032.4435366163686,Paseo de Moret nº 11,PASEO COMANDANTE FORTEA 42,15
Centro Cultural Alfredo Kraus (Fuencarral - El Pardo),3852.734081218119,Calle Pedro Rico nº 4,GLORIETA PRADERA DE VAQUERIZAS 9,3
Centro Cultural Antonio Machado (San Blas - Canillejas),2391.189670234746,Calle Gutierre de Cetina nº 77,CALLE SAN ROMAN DEL VALLE 8,6
Centro Cultural Auditorio Parque El Paraíso (San Blas - Canillejas),2099.089170714419,Calle Gutierre de Cetina nº 77,AVENIDA ARCENTALES 4,6
Centro Cultural Buenavista (Salamanca),59.160983387390026,Avenida de los Toreros nº 3,AVENIDA TOREROS 5,5
Centro Cultural Buero Vallejo (San Blas - Canillejas),3553.3667534721626,Calle Gutierre de Cetina nº 77,CALLE BOLTAÑA 27,6
Centro Cultural Carril del Conde (Hortaleza),2004.3185157406474,Calle Condesa de Venadito nº 2,CALLE CARRIL DEL CONDE 57,12
Centro Cultural Casa de Vacas (Retiro),235.40703014442803,Calle Alcalá nº 95,PASEO COLOMBIA 1,6
Centro Cultural Casa del Reloj (Arganzuela),290.46907641679246,Calle Jaime el Conquistador nº 30,PASEO CHOPERA 6,15
Centro Cultural Ciudad Pegaso (San Blas - Canillejas),5219.584875749767,Calle Gutierre de Cetina nº 77,AVENIDA SEPTIMA 11,6
Centro Cultural Clara del Rey - Museo ABC (Centro),101.26266165549646,Calle Conde Duque nº 22,CALLE AMANIEL 29,23
Centro Cultural Dotacional Integrado Arganzuela,139.66120080635244,Calle Palos de la Frontera nº 27,CALLE CANARIAS 17,8
Centro Cultural Eduardo Úrculo (Tetuán),666.3277551012181,Calle Azucenas nº 1,PLAZA DONOSO 5,12
Centro Cultural El Plantío (Moncloa - Aravaca),10842.88577041764,Avenida Complutense nº 23,CALLE JOSE LOMBANA IGLESIAS 4,8
Centro Cultural El Pozo del tío Raimundo (Puente de Vallecas),2326.373286995983,Calle Arroyo del Olivar nº 6,AVENIDA GLORIETAS 19,24
Centro Cultural Emilia Pardo Bazán (Salamanca),30.987063796944962,Calle Goya nº 1,CALLE GOYA 1 Subterráneo,14
Centro Cultural Federico Chueca (Hortaleza),2434.413764990826,Calle Carlota O'Neill nº 32,CALLE BENITA AVILA 23,14
Centro Cultural Fernando Lázaro Carreter (Carabanchel),737.5057516812386,Glorieta Marqués de Vadillo nº 9,CALLE VERDAD 29,5
Centro Cultural Fernando de los Ríos (Latina),3444.725774076352,Calle Caramuel nº 51,CALLE CAMARENA 10 B,7
Centro Cultural Fuente de San Pedro - Valderrivas (Vicálvaro),3705.95545646772,Calle Hacienda de Pavones nº 342,CALLE TITANIO 5,18
Centro Cultural Galileo (Chamberí),224.47011990353843,Calle Fernando el Católico nº 19,CALLE GALILEO 39,12
Centro Cultural Gloria Fuertes (Barajas),6302.01307396174,Calle Gutierre de Cetina nº 77,AVENIDA LOGRO&amp;Ntilde;O 179,6
Centro Cultural Hortaleza,3766.4355279786378,Calle Carlota O'Neill nº 32,CALLE SANTA VIRGILIA 15,14
